2019-10-28 19:18:55.451010 IP 172.26.143.21.60960 > 54.246.102.127.8443: Flags [S], seq 3184401959, win 29200, options [mss 1460,sackOK,TS val 497303065 ecr 0,nop,wscale 9], length 0
2019-10-28 19:18:55.690713 IP 172.26.143.21.56296 > 54.228.213.182.8443: Flags [S], seq 3658704924, win 29200, options [mss 1460,sackOK,TS val 3652369937 ecr 0,nop,wscale 9], length 0
2019-10-28 19:19:00.506822 IP 172.26.143.21.60966 > 54.246.102.127.8443: Flags [S], seq 768349406, win 29200, options [mss 1460,sackOK,TS val 497308121 ecr 0,nop,wscale 9], length 0
2019-10-28 19:19:00.746798 IP 172.26.143.21.56302 > 54.228.213.182.8443: Flags [S], seq 3261468390, win 29200, options [mss 1460,sackOK,TS val 3652374993 ecr 0,nop,wscale 9], length 0
2019-10-28 19:19:03.617361 IP 172.26.143.21.60972 > 54.246.102.127.8443: Flags [S], seq 558693685, win 29200, options [mss 1460,sackOK,TS val 497311231 ecr 0,nop,wscale 9], length 0
2019-10-28 19:19:03.857609 IP 172.26.143.21.56308 > 54.228.213.182.8443: Flags [S], seq 1668131192, win 29200, options [mss 1460,sackOK,TS val 3652378104 ecr 0,nop,wscale 9], length 0
2019-10-28 19:19:07.161812 IP 172.26.143.21.60978 > 54.246.102.127.8443: Flags [S], seq 4163588149, win 29200, options [mss 1460,sackOK,TS val 497314776 ecr 0,nop,wscale 9], length 0
2019-10-28 19:19:07.402147 IP 172.26.143.21.56314 > 54.228.213.182.8443: Flags [S], seq 3420085452, win 29200, options [mss 1460,sackOK,TS val 3652381648 ecr 0,nop,wscale 9], length 0
2019-10-28 19:19:12.396624 IP 172.26.143.21.60984 > 54.246.102.127.8443: Flags [S], seq 4228149275, win 29200, options [mss 1460,sackOK,TS val 497320011 ecr 0,nop,wscale 9], length 0
2019-10-28 19:19:12.639791 IP 172.26.143.21.56320 > 54.228.213.182.8443: Flags [S], seq 3720421415, win 29200, options [mss 1460,sackOK,TS val 3652386886 ecr 0,nop,wscale 9], length 0
2019-10-28 19:19:17.164845 IP 172.26.143.21.60992 > 54.246.102.127.8443: Flags [S], seq 3427692016, win 29200, options [mss 1460,sackOK,TS val 497324779 ecr 0,nop,wscale 9], length 0
2019-10-28 19:19:17.404729 IP 172.26.143.21.56328 > 54.228.213.182.8443: Flags [S], seq 3646546603, win 29200, options [mss 1460,sackOK,TS val 3652391651 ecr 0,nop,wscale 9], length 0
2019-10-28 19:19:21.308336 IP 172.26.143.21.60998 > 54.246.102.127.8443: Flags [S], seq 662843395, win 29200, options [mss 1460,sackOK,TS val 497328922 ecr 0,nop,wscale 9], length 0
2019-10-28 19:19:21.548868 IP 172.26.143.21.56334 > 54.228.213.182.8443: Flags [S], seq 2806169194, win 29200, options [mss 1460,sackOK,TS val 3652395795 ecr 0,nop,wscale 9], length 0
2019-10-28 19:19:26.918010 IP 172.26.143.21.61006 > 54.246.102.127.8443: Flags [S], seq 4257228145, win 29200, options [mss 1460,sackOK,TS val 497334532 ecr 0,nop,wscale 9], length 0
2019-10-28 19:19:27.158425 IP 172.26.143.21.56342 > 54.228.213.182.8443: Flags [S], seq 3719278512, win 29200, options [mss 1460,sackOK,TS val 3652401404 ecr 0,nop,wscale 9], length 0
2019-10-28 19:19:32.423782 IP 172.26.143.21.61012 > 54.246.102.127.8443: Flags [S], seq 1715372999, win 29200, options [mss 1460,sackOK,TS val 497340037 ecr 0,nop,wscale 9], length 0
2019-10-28 19:19:32.667129 IP 172.26.143.21.56348 > 54.228.213.182.8443: Flags [S], seq 158647162, win 29200, options [mss 1460,sackOK,TS val 3652406913 ecr 0,nop,wscale 9], length 0
2019-10-28 19:19:38.684542 IP 172.26.143.21.56356 > 54.228.213.182.8443: Flags [S], seq 3663665859, win 29200, options [mss 1460,sackOK,TS val 3652412930 ecr 0,nop,wscale 9], length 0
2019-10-28 19:19:38.996593 IP 172.26.143.21.61026 > 54.246.102.127.8443: Flags [S], seq 4251267280, win 29200, options [mss 1460,sackOK,TS val 497346610 ecr 0,nop,wscale 9], length 0
2019-10-28 19:19:44.651123 IP 172.26.143.21.56366 > 54.228.213.182.8443: Flags [S], seq 1436627674, win 29200, options [mss 1460,sackOK,TS val 3652418897 ecr 0,nop,wscale 9], length 0
2019-10-28 19:19:45.288814 IP 172.26.143.21.61036 > 54.246.102.127.8443: Flags [S], seq 2127449463, win 29200, options [mss 1460,sackOK,TS val 497352902 ecr 0,nop,wscale 9], length 0
2019-10-28 19:19:48.564133 IP 172.26.143.21.61044 > 54.246.102.127.8443: Flags [S], seq 686717758, win 29200, options [mss 1460,sackOK,TS val 497356177 ecr 0,nop,wscale 9], length 0
2019-10-28 19:19:49.125208 IP 172.26.143.21.56382 > 54.228.213.182.8443: Flags [S], seq 2707768524, win 29200, options [mss 1460,sackOK,TS val 3652423371 ecr 0,nop,wscale 9], length 0
2019-10-28 19:19:52.574515 IP 172.26.143.21.61050 > 54.246.102.127.8443: Flags [S], seq 3700963771, win 29200, options [mss 1460,sackOK,TS val 497360188 ecr 0,nop,wscale 9], length 0
2019-10-28 19:19:53.138245 IP 172.26.143.21.56388 > 54.228.213.182.8443: Flags [S], seq 4044637469, win 29200, options [mss 1460,sackOK,TS val 3652427384 ecr 0,nop,wscale 9], length 0
2019-10-28 19:19:58.536884 IP 172.26.143.21.61056 > 54.246.102.127.8443: Flags [S], seq 2558806433, win 29200, options [mss 1460,sackOK,TS val 497366150 ecr 0,nop,wscale 9], length 0
2019-10-28 19:19:59.100972 IP 172.26.143.21.56394 > 54.228.213.182.8443: Flags [S], seq 2488516819, win 29200, options [mss 1460,sackOK,TS val 3652433346 ecr 0,nop,wscale 9], length 0
2019-10-28 19:20:05.119642 IP 172.26.143.21.56398 > 54.228.213.182.8443: Flags [S], seq 598552869, win 29200, options [mss 1460,sackOK,TS val 3652439365 ecr 0,nop,wscale 9], length 0
2019-10-28 19:20:05.433902 IP 172.26.143.21.61066 > 54.246.102.127.8443: Flags [S], seq 3684673793, win 29200, options [mss 1460,sackOK,TS val 497373047 ecr 0,nop,wscale 9], length 0
2019-10-28 19:20:08.756622 IP 172.26.143.21.56406 > 54.228.213.182.8443: Flags [S], seq 525690063, win 29200, options [mss 1460,sackOK,TS val 3652443002 ecr 0,nop,wscale 9], length 0
2019-10-28 19:20:09.084016 IP 172.26.143.21.61074 > 54.246.102.127.8443: Flags [S], seq 443853530, win 29200, options [mss 1460,sackOK,TS val 497376697 ecr 0,nop,wscale 9], length 0
2019-10-28 19:20:14.273271 IP 172.26.143.21.56412 > 54.228.213.182.8443: Flags [S], seq 1411520140, win 29200, options [mss 1460,sackOK,TS val 3652448518 ecr 0,nop,wscale 9], length 0
2019-10-28 19:20:14.592974 IP 172.26.143.21.61080 > 54.246.102.127.8443: Flags [S], seq 4280664797, win 29200, options [mss 1460,sackOK,TS val 497382206 ecr 0,nop,wscale 9], length 0
2019-10-28 19:20:18.841183 IP 172.26.143.21.56418 > 54.228.213.182.8443: Flags [S], seq 2649790794, win 29200, options [mss 1460,sackOK,TS val 3652453086 ecr 0,nop,wscale 9], length 0
2019-10-28 19:20:19.161048 IP 172.26.143.21.61086 > 54.246.102.127.8443: Flags [S], seq 1643206971, win 29200, options [mss 1460,sackOK,TS val 497386774 ecr 0,nop,wscale 9], length 0
2019-10-28 19:20:23.652234 IP 172.26.143.21.56426 > 54.228.213.182.8443: Flags [S], seq 2934232882, win 29200, options [mss 1460,sackOK,TS val 3652457897 ecr 0,nop,wscale 9], length 0
2019-10-28 19:20:23.970753 IP 172.26.143.21.61096 > 54.246.102.127.8443: Flags [S], seq 2119107081, win 29200, options [mss 1460,sackOK,TS val 497391584 ecr 0,nop,wscale 9], length 0
2019-10-28 19:20:29.244979 IP 172.26.143.21.56434 > 54.228.213.182.8443: Flags [S], seq 1490216301, win 29200, options [mss 1460,sackOK,TS val 3652463490 ecr 0,nop,wscale 9], length 0
2019-10-28 19:20:29.573977 IP 172.26.143.21.61102 > 54.246.102.127.8443: Flags [S], seq 1396770474, win 29200, options [mss 1460,sackOK,TS val 497397187 ecr 0,nop,wscale 9], length 0
2019-10-28 19:20:35.882601 IP 172.26.143.21.56442 > 54.228.213.182.8443: Flags [S], seq 3926289988, win 29200, options [mss 1460,sackOK,TS val 3652470127 ecr 0,nop,wscale 9], length 0
2019-10-28 19:20:36.209107 IP 172.26.143.21.61110 > 54.246.102.127.8443: Flags [S], seq 3224144147, win 29200, options [mss 1460,sackOK,TS val 497403822 ecr 0,nop,wscale 9], length 0
2019-10-28 19:20:41.418138 IP 172.26.143.21.56448 > 54.228.213.182.8443: Flags [S], seq 914050045, win 29200, options [mss 1460,sackOK,TS val 3652475663 ecr 0,nop,wscale 9], length 0
2019-10-28 19:20:41.746160 IP 172.26.143.21.61116 > 54.246.102.127.8443: Flags [S], seq 4108077260, win 29200, options [mss 1460,sackOK,TS val 497409359 ecr 0,nop,wscale 9], length 0
2019-10-28 19:20:44.210409 IP 172.26.143.21.61118 > 54.246.102.127.8443: Flags [S], seq 3864012048, win 29200, options [mss 1460,sackOK,TS val 497411823 ecr 0,nop,wscale 9], length 0
2019-10-28 19:20:44.450312 IP 172.26.143.21.56454 > 54.228.213.182.8443: Flags [S], seq 3943489607, win 29200, options [mss 1460,sackOK,TS val 3652478695 ecr 0,nop,wscale 9], length 0
2019-10-28 19:20:50.220275 IP 172.26.143.21.61126 > 54.246.102.127.8443: Flags [S], seq 3280121936, win 29200, options [mss 1460,sackOK,TS val 497417833 ecr 0,nop,wscale 9], length 0
2019-10-28 19:20:50.460782 IP 172.26.143.21.56462 > 54.228.213.182.8443: Flags [S], seq 2892504432, win 29200, options [mss 1460,sackOK,TS val 3652484705 ecr 0,nop,wscale 9], length 0
2019-10-28 19:20:53.386721 IP 172.26.143.21.61132 > 54.246.102.127.8443: Flags [S], seq 47597484, win 29200, options [mss 1460,sackOK,TS val 497420999 ecr 0,nop,wscale 9], length 0
2019-10-28 19:20:53.630366 IP 172.26.143.21.56468 > 54.228.213.182.8443: Flags [S], seq 3588483544, win 29200, options [mss 1460,sackOK,TS val 3652487875 ecr 0,nop,wscale 9], length 0
2019-10-28 19:20:59.925932 IP 172.26.143.21.61142 > 54.246.102.127.8443: Flags [S], seq 24277015, win 29200, options [mss 1460,sackOK,TS val 497427538 ecr 0,nop,wscale 9], length 0
2019-10-28 19:21:00.170350 IP 172.26.143.21.56478 > 54.228.213.182.8443: Flags [S], seq 1114219377, win 29200, options [mss 1460,sackOK,TS val 3652494415 ecr 0,nop,wscale 9], length 0
2019-10-28 19:21:04.491742 IP 172.26.143.21.56482 > 54.228.213.182.8443: Flags [S], seq 4287620256, win 29200, options [mss 1460,sackOK,TS val 3652498736 ecr 0,nop,wscale 9], length 0
2019-10-28 19:21:05.129938 IP 172.26.143.21.61152 > 54.246.102.127.8443: Flags [S], seq 2837084348, win 29200, options [mss 1460,sackOK,TS val 497432742 ecr 0,nop,wscale 9], length 0
2019-10-28 19:21:08.236810 IP 172.26.143.21.56488 > 54.228.213.182.8443: Flags [S], seq 870972521, win 29200, options [mss 1460,sackOK,TS val 3652502481 ecr 0,nop,wscale 9], length 0
2019-10-28 19:21:08.867534 IP 172.26.143.21.61158 > 54.246.102.127.8443: Flags [S], seq 341333550, win 29200, options [mss 1460,sackOK,TS val 497436480 ecr 0,nop,wscale 9], length 0
2019-10-28 19:21:11.951570 IP 172.26.143.21.56496 > 54.228.213.182.8443: Flags [S], seq 2012350696, win 29200, options [mss 1460,sackOK,TS val 3652506196 ecr 0,nop,wscale 9], length 0
2019-10-28 19:21:12.590337 IP 172.26.143.21.61166 > 54.246.102.127.8443: Flags [S], seq 1426761326, win 29200, options [mss 1460,sackOK,TS val 497440202 ecr 0,nop,wscale 9], length 0
2019-10-28 19:21:18.075050 IP 172.26.143.21.56502 > 54.228.213.182.8443: Flags [S], seq 2083261839, win 29200, options [mss 1460,sackOK,TS val 3652512319 ecr 0,nop,wscale 9], length 0
2019-10-28 19:21:18.712714 IP 172.26.143.21.61172 > 54.246.102.127.8443: Flags [S], seq 336237072, win 29200, options [mss 1460,sackOK,TS val 497446325 ecr 0,nop,wscale 9], length 0
2019-10-28 19:21:21.967601 IP 172.26.143.21.56510 > 54.228.213.182.8443: Flags [S], seq 1217499696, win 29200, options [mss 1460,sackOK,TS val 3652516211 ecr 0,nop,wscale 9], length 0
2019-10-28 19:21:22.609125 IP 172.26.143.21.61180 > 54.246.102.127.8443: Flags [S], seq 2212123305, win 29200, options [mss 1460,sackOK,TS val 497450221 ecr 0,nop,wscale 9], length 0

